{
  "v": "dome_frame.v0",
  "authority": "advisory",
  "harmonic_id": "sha256:792299174de5d621241b9ef4fdf955e0bae9f31b8e5ac965255b947b499a2213",
  "frame_index": "21",
  "led_count": "241",
  "leds": [
    {
      "index": "0",
      "path": "m/241'/0'/1'",
      "h": "0",
      "s": "255",
      "v": "230",
      "fano": "1",
      "channel": "R"
    },
    {
      "index": "1",
      "path": "m/241'/1'/2'",
      "h": "30",
      "s": "255",
      "v": "255",
      "fano": "2",
      "channel": "O"
    },
    {
      "index": "2",
      "path": "m/241'/2'/3'",
      "h": "60",
      "s": "255",
      "v": "255",
      "fano": "3",
      "channel": "Y"
    },
    {
      "index": "3",
      "path": "m/241'/3'/4'",
      "h": "120",
      "s": "255",
      "v": "255",
      "fano": "4",
      "channel": "G"
    },
    {
      "index": "4",
      "path": "m/241'/4'/5'",
      "h": "240",
      "s": "255",
      "v": "255",
      "fano": "5",
      "channel": "B"
    },
    {
      "index": "5",
      "path": "m/241'/5'/6'",
      "h": "275",
      "s": "255",
      "v": "255",
      "fano": "6",
      "channel": "I"
    },
    {
      "index": "6",
      "path": "m/241'/6'/7'",
      "h": "300",
      "s": "255",
      "v": "255",
      "fano": "7",
      "channel": "V"
    },
    {
      "index": "7",
      "path": "m/241'/7'/1'",
      "h": "0",
      "s": "255",
      "v": "255",
      "fano": "1",
      "channel": "R"
    },
    {
      "index": "8",
      "path": "m/241'/8'/2'",
      "h": "30",
      "s": "255",
      "v": "255",
      "fano": "2",
      "channel": "O"
    },
    {
      "index": "9",
      "path": "m/241'/9'/3'",
      "h": "60",
      "s": "255",
      "v": "255",
      "fano": "3",
      "channel": "Y"
    },
    {
      "index": "10",
      "path": "m/241'/10'/4'",
      "h": "120",
      "s": "255",
      "v": "255",
      "fano": "4",
      "channel": "G"
    },
    {
      "index": "11",
      "path": "m/241'/11'/5'",
      "h": "240",
      "s": "255",
      "v": "255",
      "fano": "5",
      "channel": "B"
    },
    {
      "index": "12",
      "path": "m/241'/12'/6'",
      "h": "275",
      "s": "255",
      "v": "255",
      "fano": "6",
      "channel": "I"
    },
    {
      "index": "13",
      "path": "m/241'/13'/7'",
      "h": "300",
      "s": "255",
      "v": "255",
      "fano": "7",
      "channel": "V"
    },
    {
      "index": "14",
      "path": "m/241'/14'/1'",
      "h": "0",
      "s": "255",
      "v": "255",
      "fano": "1",
      "channel": "R"
    },
    {
      "index": "15",
      "path": "m/241'/15'/2'",
      "h": "30",
      "s": "255",
      "v": "255",
      "fano": "2",
      "channel": "O"
    },
    {
      "index": "16",
      "path": "m/241'/16'/3'",
      "h": "60",
      "s": "255",
      "v": "255",
      "fano": "3",
      "channel": "Y"
    },
    {
      "index": "17",
      "path": "m/241'/17'/4'",
      "h": "120",
      "s": "255",
      "v": "255",
      "fano": "4",
      "channel": "G"
    },
    {
      "index": "18",
      "path": "m/241'/18'/5'",
      "h": "240",
      "s": "255",
      "v": "255",
      "fano": "5",
      "channel": "B"
    },
    {
      "index": "19",
      "path": "m/241'/19'/6'",
      "h": "275",
      "s": "255",
      "v": "255",
      "fano": "6",
      "channel": "I"
    },
    {
      "index": "20",
      "path": "m/241'/20'/7'",
      "h": "300",
      "s": "255",
      "v": "255",
      "fano": "7",
      "channel": "V"
    },
    {
      "index": "21",
      "path": "m/241'/21'/1'",
      "h": "0",
      "s": "255",
      "v": "255",
      "fano": "1",
      "channel": "R"
    },
    {
      "index": "22",
      "path": "m/241'/22'/2'",
      "h": "30",
      "s": "255",
      "v": "255",
      "fano": "2",
      "channel": "O"
    },
    {
      "index": "23",
      "path": "m/241'/23'/3'",
      "h": "60",
      "s": "255",
      "v": "255",
      "fano": "3",
      "channel": "Y"
    },
    {
      "index": "24",
      "path": "m/241'/24'/4'",
      "h": "120",
      "s": "255",
      "v": "255",
      "fano": "4",
      "channel": "G"
    },
    {
      "index": "25",
      "path": "m/241'/25'/5'",
      "h": "240",
      "s": "255",
      "v": "255",
      "fano": "5",
      "channel": "B"
    },
    {
      "index": "26",
      "path": "m/241'/26'/6'",
      "h": "275",
      "s": "255",
      "v": "255",
      "fano": "6",
      "channel": "I"
    },
    {
      "index": "27",
      "path": "m/241'/27'/7'",
      "h": "300",
      "s": "255",
      "v": "255",
      "fano": "7",
      "channel": "V"
    },
    {
      "index": "28",
      "path": "m/241'/28'/1'",
      "h": "0",
      "s": "255",
      "v": "255",
      "fano": "1",
      "channel": "R"
    },
    {
      "index": "29",
      "path": "m/241'/29'/2'",
      "h": "30",
      "s": "255",
      "v": "255",
      "fano": "2",
      "channel": "O"
    },
    {
      "index": "30",
      "path": "m/241'/30'/3'",
      "h": "60",
      "s": "255",
      "v": "255",
      "fano": "3",
      "channel": "Y"
    },
    {
      "index": "31",
      "path": "m/241'/31'/4'",
      "h": "120",
      "s": "255",
      "v": "255",
      "fano": "4",
      "channel": "G"
    },
    {
      "index": "32",
      "path": "m/241'/32'/5'",
      "h": "240",
      "s": "255",
      "v": "255",
      "fano": "5",
      "channel": "B"
    },
    {
      "index": "33",
      "path": "m/241'/33'/6'",
      "h": "275",
      "s": "255",
      "v": "255",
      "fano": "6",
      "channel": "I"
    },
    {
      "index": "34",
      "path": "m/241'/34'/7'",
      "h": "300",
      "s": "255",
      "v": "255",
      "fano": "7",
      "channel": "V"
    },
    {
      "index": "35",
      "path": "m/241'/35'/1'",
      "h": "0",
      "s": "255",
      "v": "255",
      "fano": "1",
      "channel": "R"
    },
    {
      "index": "36",
      "path": "m/241'/36'/2'",
      "h": "30",
      "s": "255",
      "v": "255",
      "fano": "2",
      "channel": "O"
    },
    {
      "index": "37",
      "path": "m/241'/37'/3'",
      "h": "60",
      "s": "255",
      "v": "255",
      "fano": "3",
      "channel": "Y"
    },
    {
      "index": "38",
      "path": "m/241'/38'/4'",
      "h": "120",
      "s": "255",
      "v": "255",
      "fano": "4",
      "channel": "G"
    },
    {
      "index": "39",
      "path": "m/241'/39'/5'",
      "h": "240",
      "s": "255",
      "v": "255",
      "fano": "5",
      "channel": "B"
    },
    {
      "index": "40",
      "path": "m/241'/40'/6'",
      "h": "275",
      "s": "255",
      "v": "255",
      "fano": "6",
      "channel": "I"
    },
    {
      "index": "41",
      "path": "m/241'/41'/7'",
      "h": "300",
      "s": "255",
      "v": "255",
      "fano": "7",
      "channel": "V"
    },
    {
      "index": "42",
      "path": "m/241'/42'/1'",
      "h": "0",
      "s": "255",
      "v": "255",
      "fano": "1",
      "channel": "R"
    },
    {
      "index": "43",
      "path": "m/241'/43'/2'",
      "h": "30",
      "s": "255",
      "v": "255",
      "fano": "2",
      "channel": "O"
    },
    {
      "index": "44",
      "path": "m/241'/44'/3'",
      "h": "60",
      "s": "255",
      "v": "255",
      "fano": "3",
      "channel": "Y"
    },
    {
      "index": "45",
      "path": "m/241'/45'/4'",
      "h": "120",
      "s": "255",
      "v": "255",
      "fano": "4",
      "channel": "G"
    },
    {
      "index": "46",
      "path": "m/241'/46'/5'",
      "h": "240",
      "s": "255",
      "v": "255",
      "fano": "5",
      "channel": "B"
    },
    {
      "index": "47",
      "path": "m/241'/47'/6'",
      "h": "275",
      "s": "255",
      "v": "255",
      "fano": "6",
      "channel": "I"
    },
    {
      "index": "48",
      "path": "m/241'/48'/7'",
      "h": "300",
      "s": "255",
      "v": "255",
      "fano": "7",
      "channel": "V"
    },
    {
      "index": "49",
      "path": "m/241'/49'/1'",
      "h": "0",
      "s": "255",
      "v": "255",
      "fano": "1",
      "channel": "R"
    },
    {
      "index": "50",
      "path": "m/241'/50'/2'",
      "h": "30",
      "s": "255",
      "v": "255",
      "fano": "2",
      "channel": "O"
    },
    {
      "index": "51",
      "path": "m/241'/51'/3'",
      "h": "60",
      "s": "255",
      "v": "255",
      "fano": "3",
      "channel": "Y"
    },
    {
      "index": "52",
      "path": "m/241'/52'/4'",
      "h": "120",
      "s": "255",
      "v": "255",
      "fano": "4",
      "channel": "G"
    },
    {
      "index": "53",
      "path": "m/241'/53'/5'",
      "h": "240",
      "s": "255",
      "v": "255",
      "fano": "5",
      "channel": "B"
    },
    {
      "index": "54",
      "path": "m/241'/54'/6'",
      "h": "275",
      "s": "255",
      "v": "255",
      "fano": "6",
      "channel": "I"
    },
    {
      "index": "55",
      "path": "m/241'/55'/7'",
      "h": "300",
      "s": "255",
      "v": "255",
      "fano": "7",
      "channel": "V"
    },
    {
      "index": "56",
      "path": "m/241'/56'/1'",
      "h": "0",
      "s": "255",
      "v": "255",
      "fano": "1",
      "channel": "R"
    },
    {
      "index": "57",
      "path": "m/241'/57'/2'",
      "h": "30",
      "s": "255",
      "v": "255",
      "fano": "2",
      "channel": "O"
    },
    {
      "index": "58",
      "path": "m/241'/58'/3'",
      "h": "60",
      "s": "255",
      "v": "255",
      "fano": "3",
      "channel": "Y"
    },
    {
      "index": "59",
      "path": "m/241'/59'/4'",
      "h": "120",
      "s": "255",
      "v": "255",
      "fano": "4",
      "channel": "G"
    },
    {
      "index": "60",
      "path": "m/241'/60'/5'",
      "h": "240",
      "s": "255",
      "v": "255",
      "fano": "5",
      "channel": "B"
    },
    {
      "index": "61",
      "path": "m/241'/61'/6'",
      "h": "275",
      "s": "255",
      "v": "255",
      "fano": "6",
      "channel": "I"